concept,source language text,target language text,variations,label
hard,I tried a really hard one then.,फिर मैंने एक बहुत कठिन सवाल चुना.,"['कठिन', 'मुश्किल']",कठिन
hard,Dragon trapping is hard enough work as it is without do-gooder dragon riders... sneaking in to rescue them.,"ड्रैगन पकड़ना अपने में ही कठिन काम है, उस पर उन्हें बचाने के लिए चोरी-छिपे आने वाले... परोपकारी ड्रैगन-सवारों की मुसीबत।","['कठिन', 'मुश्किल']",कठिन
hard,Trying to measure the atmospheric composition of an exoplanet passing in front of its host star is hard.,सौर मंडल के बाहर के ग्रह के वातावरण का संघटन ज्ञात करना मुश्किल है जब वह अपने मेज़बान तारे के आगे से गुज़र रहा हो।,"['कठिन', 'मुश्किल']",मुश्किल
hard,"(Laughter) LC: When I heard this young lady speak before I came out -- she was so beautiful, and I wished I could be like that, and my husband, poor darling -- I lost him after we were married 70 years -- didn't agree on one thing, never did, nothing, but we got along together because he learned to understand me, and that was just hard, because he was so different.","(हंसी) लिया: मेरे मंच पर आने से पहले जब मैंने इस युवती को सुना... वह इतनी खूबसूरत थी, और मैंने सोचा काश मैं ऐसी होती, और मेरे पति, बेचारे... शादी के ७० सालों के बाद मैंने उन्हें खो दिया... एक बात पर सहमत नहीं होते थे, कभी नहीं हुए, किसी बात पर भी, पर हमारी अच्छी निभती थी क्योंकि वे मुझे समझना जान गए थे, और वह बहुत मुश्किल था, क्योंकि वह इतने अलग थे।","['कठिन', 'मुश्किल']",मुश्किल
environment,"Environment is very, very crucial.",पर्यावरण बहुत ही ज्यादा ज़रूरी है।,"['पर्यावरण', 'वातावरण']",पर्यावरण
environment,"The only way they're going to lift themselves out of energy poverty is by adapting fuels that are more efficient, that are less expensive, that are better for human health, better for the environment and that are more productive.","उनके लिए स्वयं को ऊर्जा गरीबी से बाहर निकालने का एकमात्र तरीका अधिक कुशल ऐसे ईंधन को अपनाना है, जो कम खर्चीले हैं, जो मानव स्वास्थ्य और पर्यावरण के लिए बेहतर हैं और जो अधिक उत्पादक हैं।","['पर्यावरण', 'वातावरण']",पर्यावरण
environment,"And then an idea began to take root, born from my concern for our environment.","और फिर एक विचार ने जड़ रूप लेना शुरू किया, जो हमारे पर्यावरण के लिए मेरी चिंता से उपजा","['पर्यावरण', 'वातावरण']",पर्यावरण
environment,"So if you read the literature, it is well known that human attention is drawn to novelty, things that are new in the environment.","इसलिए यदि आप साहित्य पढ़ते हैं, यह जाना जाता है कि मानव ध्यान नवीनता की ऑर आकर्षित होता है, जो चीजें पर्यावरण में नई हैं।","['पर्यावरण', 'वातावरण']",पर्यावरण
environment,"And I'm afraid, looking forward, we are in the age of pandemics, we have to behave like that, we need to practice One Health, we need to understand that we're living in the same world as animals, the environment, and us, and we get rid of this fiction that we are some kind of special species.","और मुझे डर है, आगे देखने पर, हम महामारी के युग में हैं, हमें ऐसा व्यवहार करना होगा, हमें एक स्वास्थ्य का अभ्यास करने की आवश्यकता है, हमें समझने की जरूरत है हम उसी दुनिया में रह रहे हैं जानवरों के रूप में, पर्यावरण, और हमें, और इस कल्पना से छुटकारा पाना है कि हम कुछ विशेष प्रकार की प्रजातियाँ हैं।","['पर्यावरण', 'वातावरण']",पर्यावरण
environment,"This is what's happening, and in fact, we're slowly moving, not away from genomics, but incorporating genomics into what we call multi-order, semi-autonomous, self-regulating systems, like cells, like organs, like environments.","यह क्या हो रहा है, और वास्तव में, हम धीरे-धीरे आगे बढ़ रहे हैं, जीनोमिक्स से दूर नही, बल्कि जीनोमिक्स को हम क्या कहते बहु-व्यवस्था, अर्द्ध स्वायत्त, आत्म विनियमन प्रणालियों,मेँ शामिल करते हुये जैसे कोशिकायेँ, जैसे जीवोँ, जैसे वातावरण|","['पर्यावरण', 'वातावरण']",वातावरण
environment,"If jobs is a solution, don't you think, then, that we should be simplifying the business environment of all of these countries?","अगर नौकरियाँ समाधान हैं, तो क्या इन सारे देशों का व्यवसायी वातावरण और सरल नहीं होना चाहिए?","['पर्यावरण', 'वातावरण']",वातावरण
environment,"It was a very dynamic environment, because particularly in those middle school years -- fifth through eighth grade -- keeping people engaged and setting the tone that everybody in the classroom needs to pay attention, nobody gets to make fun of it or have the position of the kid who doesn't want to be there.","बहुत ही गतिशील वातावरण था, क्योंकि विशेष रूप से माध्यमिक स्कूल के उन वर्षों में -- पांचवी से आठवीं तक -- लोगों को जोड़े रखने के लिए और एक लय बनाने के लिए ताकि कक्षा में सभी ध्यान दें, कोई भी इसका मज़ाक न बनाए या उस बच्चे का स्थान ले जिसका ध्यान कहीं और है।","['पर्यावरण', 'वातावरण']",वातावरण
environment,It fits into the environment. It is the environment.,यह वातावरण में फिट बैठता है. यह खुद वातावरण है.,"['पर्यावरण', 'वातावरण']",वातावरण
blood,"I wore a sanitary pad. I filled animal blood in a football bottle, I tied it up here, there is a tube going into my panties, while I'm walking, while I'm cycling, I made a press, doses of blood will go there.","तो मैने सैनेटरी पैद पहना. एक फुटबॉल बॉटल में जानवर का खून भर कर यहाँ बाँध दिया,.इससे निकलकर एक ट्युब मेरी चड्डी के अंदर जाती थी. चलते समय, साईकल चलाते समय, मैं उसको दबाता था, जिससे ट्युब से ख़ून निकलता था.","['खून', 'रक्त']",खून
blood,"When you eat healthier, manage stress, exercise and love more, your brain actually gets more blood flow and more oxygen.","जब आप स्वस्थ खाना खाते हैं, मानसिक दबाव को संभालते हैं और ज्यादा कसरत और प्यार करते हैं, तब आपके मस्तिष्क में ज्यादा खून और ऑक्सीजन जाती है।","['खून', 'रक्त']",खून
blood,And if we don't eat his flesh or drink his blood we won't inherit eternal life.,और अगर हम इसका मांस नहीं खाये या इसका खून नहीं पीये ... ... तो हमें अमरता नहीं हासिल होगी.,"['खून', 'रक्त']",खून
blood,They'll pay with their own blood.,वे अपने ही खून से कीमत चुकायेंगे.,"['खून', 'रक्त']",खून
blood,Anoint these with a drop of Hope's blood.,आशा के खून की एक बूंद के साथ इन अभिषेक।,"['खून', 'रक्त']",खून
blood,"They ended up sending seven units of red blood cells, four units of plasma and two units of platelets.","आखिर उन्होंने भेजीं लाल रक्त कोशिकाओं की सात इकाइयां, प्लाज्मा की चार इकाइयां और प्लेटलेट्स की दो इकाइयां।","['खून', 'रक्त']",रक्त
blood,It's the bind of soul and blood oath.,यह आत्मा और रक्त शपथ का बाँध है।,"['खून', 'रक्त']",रक्त
blood,If we forge a blade using the blood of the last living Labonair...,हम रक्त का उपयोग एक ब्लेड बनाने हैं अंतिम जीवित Labonair की ...,"['खून', 'रक्त']",रक्त
picture,And it turns out that pictures of brains have special properties.,और यह पता चला है कि दिमाग के चित्र में विशेष गुण है।,"['चित्र', 'तस्वीर']",चित्र
picture,Is this a beautiful picture or is it a terrible picture?,ये एक सुंदर चित्र है -- या फ़िर ये एक बेहद खराब चित्र है ?,"['चित्र', 'तस्वीर']",चित्र
picture,We take the pictures of those mini-Big Bangs inside detectors.,हम अनुवेदकों के अन्दर छोटे धमाकों की तस्वीर लेते हैं।,"['चित्र', 'तस्वीर']",तस्वीर
picture,"In other words, when we saw that picture on September 10th we knew the machine worked, which is a great triumph.","दूसरे शब्दों में, जब हमने 10 सितम्बर को वह तस्वीर देखी तो हम समझ गए कि मशीन काम कर गयी है, जो कि एक बहुत बड़ी जीत है।","['चित्र', 'तस्वीर']",तस्वीर
picture,Your picture on the wall?,दीवार पर तुम्हारी तस्वीर?,"['चित्र', 'तस्वीर']",तस्वीर
side,"They were blank on one side, and on the other side I listed some simple instructions.","बस इस तरह की। वे एक तरफ कोरे थे, और दूसरी तरफ मैंने कुछ सरल निर्देश सूचीबद्ध किए हैं।","['पक्ष', 'तरफ']",तरफ
side,"I could see pictures they were tagged in, posts they'd written, memes they'd shared, and somehow, seeing that it was a human on the other side of the screen made me feel a little better.","मैं उन चित्रों को देखता जिनमें वे टैग किए गए, वे पोस्ट जो उन्होंने लिखे थे, मिम्स जो उन्होंने साझा किये थे, और किसी भी तरह, यह देखना कि स्क्रीन के दूसरी तरफ एक इंसान था मुझे थोड़ा बेहतर महसूस कराता था।","['पक्ष', 'तरफ']",तरफ
side,"So imagine this: you call an Uber, it takes you to a nearby landing spot -- we call these vertiports -- there's an airplane waiting for you there, flies you over all of the traffic in the middle, and on the other side, another Uber takes you to your friend's house.","तो कल्पना कीजिए: आप उबर बुलाते हैं जो आपको पास के लैंडिंग स्पॉट पर ले जाती है-- इनको ऊर्ध्वमुखी हवाई अड्डे कहते हैं-- वहां हवाई जहाज आपका इंतज़ार कर रहा है, आपको यातायात के ऊपर से उड़ा ले जाता है, दूसरी तरफ खड़ी एक और उबर आपको मित्र के घर पहुंचा देती है","['पक्ष', 'तरफ']",तरफ
side,"And Doaa climbed onto the ring, her arms and her legs dangling by the side.","और डोआ उस चक्र पर चढ़ गयी, उसकी टांगें और बाहें दोनों तरफ लटक रही थीं।","['पक्ष', 'तरफ']",तरफ
side,"So let me invite you to consider taking the third side, even as a very small step.",तो मैं आप को आमंत्रित करता हूँ कि तीसरे पक्ष की भूमिका निभाने को एक छोटी शुरुवात के रूप में देखें।,"['पक्ष', 'तरफ']",पक्ष
side,That's a third-side act.,यही तीसरे पक्ष का कार्य है।,"['पक्ष', 'तरफ']",पक्ष
side,- Take her side?,- उसका पक्ष ले लो?,"['पक्ष', 'तरफ']",पक्ष
side,God takes sides.,भगवान पक्षों लेता है।,"['पक्ष', 'तरफ']",पक्ष
bear,"My boys now are three years and five months old today, and they were already born with three nationalities and four languages.","अब मेरे बच्चे ३ साल और ५ महीने के हुए हैं आज, और जन्म से उनकी ३ राष्टीयतायें हैं और ४ भाषायें|","['जन्म', 'पैदा']",जन्म
bear,"You see, in patriarchal societies, right from the very beginning, when a girl is born, her birth is not celebrated.","जैसा कि आप देखते हैं, पुरुष प्रधान समाजों में, शुरू से ही, जब एक लड़की जन्म लेती है, उसका जन्म मनाया नहीं जाता |","['जन्म', 'पैदा']",जन्म
bear,(Clapping) The Juba dance was born from enslaved Africans' experience on the plantation.,जुबा नृत्य का जन्म हुआ था गुलाम अफ्रीकियों के बागानों के अनुभव से|,"['जन्म', 'पैदा']",जन्म
bear,"What if our future is not dead, but still waiting to be born?","अगर हमारा भविष्य मृत ना हो, बल्कि जन्म लेने के इंतज़ार में हो?","['जन्म', 'पैदा']",जन्म
bear,He came back from the war wounded... and died six months before I was born.,वे वापस आ गये युद्ध से घायल हो कर ... ... और मेरे जन्म के छह महीने पहले उनकी मृत्यु हो गई.,"['जन्म', 'पैदा']",जन्म
bear,"Tell her she was born as you were, as your mothers before, and the sisters beside them, in the age of legends, like always.","वह भी आप की तरह ही पैदा हुई जैसे आप की माँ और उनके साथ आपकी बहनें बहादुरों के समय, हमेशा की तरह","['जन्म', 'पैदा']",पैदा
bear,"He will marry her in the spring, during Dionysus' Festival and when her first son is born her sweet uncle Attalus will convince Philip to name the boy his successor with himself as regent.","वह Dionysus 'महोत्सव के दौरान , वसंत में उससे शादी करेगा... ... और जब उसका पहला बेटा पैदा हुआ है... ... उसे मिठाई चाचा Attalus लड़का अपने उत्तराधिकारी के नाम के लिए फिलिप मना लेंगे...","['जन्म', 'पैदा']",पैदा
bear,And I saw my kids being born.,और मैं अपने बच्चों को पैदा किया जा रहा देखा.,"['जन्म', 'पैदा']",पैदा
bear,I wish you'd never been born!,काश तुम कभी पैदा ही न हुए होते!,"['जन्म', 'पैदा']",पैदा
line,"And there, along this line, was this thing, this glorious, bewildering thing.","और फिर, इसी रेखा के पास, यह चीज़ थी, यह शानदार, विस्मयकारी चीज़।","['लाइन', 'रेखा']",रेखा
line,"And finally, at the end of the journey, I could see this thin little yellow line across the horizon.",और अंततः हमारी यात्रा खत्म हुई मुझे दूर क्षितिज पर एक पतली पीली रेखा दिख रही थी।,"['लाइन', 'रेखा']",रेखा
line,"So we lay epinephrine flat on a page, and then we replace all the spheres with simple letters, and then the bonds that lie in the plane of the page, they just become regular lines, and the bonds that point forwards and backwards, they become little triangles, either solid or dashed to indicate depth.","एपिनेफ्रीन को कागज पर सीधा रखते हैं, गाेलाें के स्थान पर अक्षर लगा देते हैं, फिर बॉन्ड जो पृष्ठ की सतह पर हैं, वे बस लाइन बन जाते हैं, बांड जो आगे और पीछे इंगित करते हैं, छोटे त्रिकोण बन जाते हैं, गहराई दिखाने के लिए ठोस या डैश.","['लाइन', 'रेखा']",लाइन
line,"In fact, they were so rare that elected members of Parliament had the right to allocate 15 telephone lines as a favor to those they deemed worthy.","यहाँ तक की इतना दुर्लभ था की सांसदों को यह अधिकार था की वे १५ फोन की लाइन बाँट सकते थे, जिन्हें वे योग्य समझते थे.","['लाइन', 'रेखा']",लाइन
line,"He was with us for a little while, but at some point he started spamming dashes in the chat, like a big long line of dashes all the way across the screen.","वह थोड़ी देर के लिए हमारे साथ था, लेकिन एक बार उसने शुरू किया चैट में स्पैमिंग डैश, जैसे डैश की एक बड़ी लंबी लाइन स्क्रीन पर .","['लाइन', 'रेखा']",लाइन
line,We hit that county line for one quick round,हमएकत्वरितदौर केलिएकिकाउंटी लाइन मारा,"['लाइन', 'रेखा']",लाइन
line,I need you to bring them up the line.,मैं लाइन उन्हें ऊपर लाने के लिए आप की जरूरत है.,"['लाइन', 'रेखा']",लाइन
break,"Then pretty soon, I was broke too.","तो बहुत जल्द ही, मैं भी टूट गया था।","['तोड/तोड़', 'टूट']",टूट
break,"You have classmates, teachers, law enforcement officers, technologists, scientists, doctors, who are all scrambling to make sense of new realities when their social circles are broken.","आप के सहपाठी, शिक्षक, कानून प्रवर्तन अधिकारीगण, प्रौद्योगिकीविद, वैज्ञानिक, डॉक्टर, हैं जो सब नई वास्तविकताओं का मतलब समझने के लिए हाथ पांव मार रहे हैं जब उनके सामाजिक दायरे टूट जाते हैं।","['तोड/तोड़', 'टूट']",टूट
break,It tells us that the hymen breaks and bleeds the first time a woman has vaginal sex.,यह हमें बताया जाता है कि हेमेन याने योनी परदा टूटता है और रक्तस्राव होता है यह होता है पहली बार सम्भोग के समय.,"['तोड/तोड़', 'टूट']",टूट
break,"If you fall, your limbs will break.",अगर तुम गिर गये तो तुम्हारी टांगे टूट जायेगी.,"['तोड/तोड़', 'टूट']",टूट
break,"I know this firsthand, because these laws and systems, well, they broke up my family, and they led my parents to return to Mexico.","मुझे यह पहली बार पता है, क्योंकि इन कानूनों और प्रणालियों, खैर, उन्होंने मेरे परिवार को तोड़ दिया, और उन्होंने मेरे माता-पिता का नेतृत्व किया मेक्सिको लौटने के लिए।","['तोड/तोड़', 'टूट']",तोड/तोड़
break,I'll break his limbs and lock him up.,मैं उसकी टाँगे तोड़कर लॉक-अप में डाल दूँगा.,"['तोड/तोड़', 'टूट']",तोड/तोड़
break,(GROANING) When you hit him on the head you broke the thread.,(कराहना) आप आप धागा तोड़ा सिर पर उसे मारा.,"['तोड/तोड़', 'टूट']",तोड/तोड़
break,"You can break a marriage, but not a promise.","आप एक शादी है, लेकिन नहीं एक वादा तोड़ सकते हैं।","['तोड/तोड़', 'टूट']",तोड/तोड़
break,Why did you break in?,क्यों आप में तोड़ दिया?,"['तोड/तोड़', 'टूट']",तोड/तोड़
break,It used to break a magical link.,यह एक जादुई लिंक को तोड़ने के लिए इस्तेमाल किया।,"['तोड/तोड़', 'टूट']",तोड/तोड़
